{
  "$schema": "http://json-schema.org/draft-07/schema#",
  "$id": "https://agent-os.dev/schemas/agent.json",
  "title": "Agent Specification",
  "description": "Schema for defining an Agent in Agent OS",
  "type": "object",
  "required": ["id", "name", "version", "runtime", "tools", "policies"],
  "properties": {
    "id": {
      "type": "string",
      "pattern": "^[a-z0-9-]+$",
      "description": "Unique identifier for the agent"
    },
    "name": {
      "type": "string",
      "description": "Human-readable name"
    },
    "version": {
      "type": "string",
      "pattern": "^\\d+\\.\\d+\\.\\d+$",
      "description": "Semantic version"
    },
    "description": {
      "type": "string",
      "description": "Agent description"
    },
    "runtime": {
      "type": "string",
      "enum": ["agno", "langchain", "custom"],
      "description": "Runtime adapter to use"
    },
    "tools": {
      "type": "array",
      "items": {
        "type": "string"
      },
      "description": "List of tool IDs this agent can use"
    },
    "policies": {
      "type": "array",
      "items": {
        "type": "string"
      },
      "description": "List of policy IDs to enforce"
    },
    "config": {
      "type": "object",
      "description": "Runtime-specific configuration"
    }
  }
}
